{
  "assurance": "human-asserted",
  "caseId": "SD-2026-08-05-lead-qualification",
  "environmentFitness": "not-environment-bound",
  "expiresAt": null,
  "human": {
    "applicabilityScope": null,
    "authorityRole": "requirement-owner",
    "effectiveAt": "2026-08-05T20:22:44Z",
    "identity": "Dominik",
    "mechanism": "vscode-mcp-elicitation-v1"
  },
  "limitations": [
    "n/a"
  ],
  "observedAt": "2026-08-05T20:22:44Z",
  "org": null,
  "package": null,
  "probeId": null,
  "query": null,
  "questionId": null,
  "rawResultDigest": null,
  "receiptId": "EV-20260805T202244Z-231673598df2",
  "result": {
    "completeness": "complete",
    "derivedFacts": {
      "answer": "jest pelny"
    },
    "kind": "human-answer"
  },
  "schemaVersion": 1,
  "sensitivityClass": "non-sensitive",
  "sha256": "sha256:c1f26340e054735da2a1c3ae8b57c569552d035479f9fe1636a32b7cd644b3e7",
  "source": null,
  "sourceType": "human-sme-attestation",
  "transform": {
    "policyDigest": "sha256:026b5ab5caf0e65c7a48316dfd303e79d7b576231a44f6f01a67f23f9955b96c",
    "version": 1
  },
  "validationPurpose": "design-evidence"
}
