{
  "assurance": "source-exact",
  "caseId": "SD-2026-08-05-lead-qualification",
  "environmentFitness": "not-environment-bound",
  "expiresAt": null,
  "human": null,
  "limitations": [],
  "observedAt": "2026-08-05T20:47:26Z",
  "org": null,
  "package": null,
  "probeId": null,
  "query": null,
  "questionId": null,
  "rawResultDigest": "sha256:386439e718d8c679dfc0dad60aeb94182764b9cc531a88cf030e42b7d0dd7658",
  "receiptId": "EV-20260805T204726Z-8d3a99b7a689",
  "result": {
    "completeness": "complete",
    "derivedFacts": {
      "byteSize": 228,
      "lineCount": 13,
      "mode": "100644"
    },
    "kind": "repository-source"
  },
  "schemaVersion": 1,
  "sensitivityClass": "non-sensitive",
  "sha256": "sha256:542a7e427007dc11e9427f7e2e06bc63614d18ea3c3844fa93be5190b3a51a27",
  "source": {
    "blobOid": "2afc734958b0c9b431948e2195bf4164613119da",
    "contentDigest": "sha256:386439e718d8c679dfc0dad60aeb94182764b9cc531a88cf030e42b7d0dd7658",
    "coverage": "full",
    "identity": "sha256:0ef60e0dcd2628c4f94a6a3459c6373b5f7c003a3e468705876a7beea07c075e",
    "kind": "git-blob",
    "path": "sfdx-project.json",
    "range": null,
    "revision": "c9923174b45836dc0656630361eca2d53ba4b057",
    "workingTreeDrift": false
  },
  "sourceType": "repository-receipt",
  "transform": {
    "policyDigest": "sha256:81cd888544c1050e5d9a1adf65d96754b01e7afb9f978890d7b4f3fbfd780a7d",
    "version": 1
  },
  "validationPurpose": "design-evidence"
}
