{
  "assurance": "human-asserted",
  "caseId": "SD-2026-08-05-lead-qualification",
  "environmentFitness": "not-environment-bound",
  "expiresAt": null,
  "human": {
    "applicabilityScope": null,
    "authorityRole": "requirement-owner",
    "effectiveAt": "2026-08-05T20:22:12Z",
    "identity": "Dominik",
    "mechanism": "vscode-mcp-elicitation-v1"
  },
  "limitations": [
    "visual page layout"
  ],
  "observedAt": "2026-08-05T20:22:12Z",
  "org": null,
  "package": null,
  "probeId": null,
  "query": null,
  "questionId": null,
  "rawResultDigest": null,
  "receiptId": "EV-20260805T202212Z-89f7b4b740b5",
  "result": {
    "completeness": "complete",
    "derivedFacts": {
      "answer": "yes completed"
    },
    "kind": "human-answer"
  },
  "schemaVersion": 1,
  "sensitivityClass": "non-sensitive",
  "sha256": "sha256:de99afcdc2361575baffa4a35b7792d3c1adcd804a1fdda2363ad39f22bbb58a",
  "source": null,
  "sourceType": "human-sme-attestation",
  "transform": {
    "policyDigest": "sha256:026b5ab5caf0e65c7a48316dfd303e79d7b576231a44f6f01a67f23f9955b96c",
    "version": 1
  },
  "validationPurpose": "design-evidence"
}
